{
  "$schema": "http://json-schema.org/draft-07/schema#",
  "$id": "arkavo-taxonomy-map-v1",
  "title": "Arkavo Taxonomy Map v1",
  "description": "Versioned mapping from taxonomy labels to OpenTDF attributes. The map is data, not policy: it says which attributes a label implies and what happens to a payload whose requester does not hold them. Authorization itself stays with the KAS and the policy decision point.",
  "type": "object",
  "required": ["version", "namespace", "attributeDefinitions", "labels"],
  "additionalProperties": false,
  "properties": {
    "$schema": { "type": "string" },
    "version": {
      "type": "string",
      "pattern": "^\\d+\\.\\d+\\.\\d+$",
      "description": "Map version, recorded in sentinel evidence and bound by the pack manifest signature"
    },
    "namespace": {
      "type": "string",
      "format": "uri",
      "description": "Attribute namespace every definition FQN extends"
    },
    "attributeDefinitions": {
      "type": "array",
      "minItems": 1,
      "description": "OpenTDF attribute definitions. Definitions are conjunctive with one another: a requester must satisfy every definition a label names.",
      "items": {
        "type": "object",
        "required": ["name", "fqn", "rule"],
        "additionalProperties": false,
        "properties": {
          "name": { "type": "string", "pattern": "^[a-z][a-z0-9-]*$" },
          "fqn": { "type": "string", "format": "uri" },
          "rule": {
            "type": "string",
            "enum": ["hierarchy", "allOf", "anyOf"],
            "description": "hierarchy: ordered levels, holding a level grants every lower level. allOf: requester must hold every named value. anyOf: requester must hold at least one."
          },
          "order": {
            "type": "array",
            "items": { "type": "string" },
            "description": "For hierarchy definitions, platform creation order is highest privilege to lowest. Runtime lookup is by value name, not by index. Reordering is unsafe: it changes access on existing TDFs."
          },
          "values": {
            "type": "array",
            "items": { "type": "string", "pattern": "^[a-z0-9]+(-[a-z0-9]+)*$" },
            "description": "Known values as single-segment lowercase slugs. An empty array means the definition is populated per tenant or via dynamic value mappings."
          },
          "dynamicValueMapping": {
            "type": "object",
            "additionalProperties": false,
            "description": "Pulls values from the entity representation so a definition can scale without registering every value. ANY_OF and ALL_OF only; cannot combine with value-level subject mappings. Comparison is case-sensitive.",
            "required": ["entityPath", "operator"],
            "properties": {
              "entityPath": { "type": "string" },
              "operator": { "type": "string", "enum": ["IN", "IN_CONTAINS"] }
            }
          },
          "onTdf": {
            "type": "boolean",
            "default": true,
            "description": "When false, this definition organizes the corpus (which knowledge adapter to train) and is never written to TDF dataAttributes."
          },
          "description": { "type": "string" }
        }
      }
    },
    "labels": {
      "type": "array",
      "minItems": 1,
      "description": "Taxonomy labels a classifier or reference tier may emit",
      "items": {
        "type": "object",
        "required": ["label", "category", "sensitivity", "requires", "wrapAttributes", "unentitled"],
        "additionalProperties": false,
        "properties": {
          "label": { "type": "string", "pattern": "^[a-z][a-z0-9-]*$" },
          "category": {
            "type": "string",
            "enum": ["Pii", "Credentials", "Financial", "Healthcare", "Internal", "Public"],
            "description": "DataCategory this label maps onto"
          },
          "sensitivity": {
            "type": "string",
            "enum": ["Public", "Internal", "Confidential", "Restricted"],
            "description": "SensitivityLevel floor this label implies. Merging labels takes the maximum."
          },
          "requires": {
            "type": "array",
            "description": "Attributes the requester must hold. Conjunctive across definitions.",
            "items": { "$ref": "#/definitions/attributeValue" }
          },
          "wrapAttributes": {
            "type": "array",
            "description": "Attributes placed in dataAttributes when a payload carrying this label is wrapped for transport",
            "items": { "$ref": "#/definitions/attributeValue" }
          },
          "unentitled": {
            "type": "string",
            "enum": ["block", "hold", "redact"],
            "description": "Disposition when the requester does not hold the required attributes. Wrapping never rescues an unauthorized disclosure, so allow is not a legal value here."
          },
          "neverRelease": {
            "type": "boolean",
            "default": false,
            "description": "Blocked unconditionally regardless of entitlement, wrapping, or destination"
          },
          "description": { "type": "string" }
        }
      }
    },
    "derived": {
      "type": "object",
      "description": "Second table: data-derived definitions in a separate namespace. The sentinel still only labels; this table is the only place a derived label becomes a data attribute. Open-ended tags never appear here. At wrap, every derived tag is asserted; a tag is stamped as a data attribute only when stamp is true, the value is declared, and its score meets threshold. ALL_OF only — ANY_OF would let an unpromoted tag bypass a promoted conjunct. Promotion tightens subject mapping on an already-stamped value; it does not add the value at wrap.",
      "additionalProperties": false,
      "patternProperties": {
        "^https://derived\\.[^/]+/attr/[a-z][a-z0-9-]*$": {
          "type": "object",
          "additionalProperties": false,
          "required": ["rule", "values", "source", "threshold", "stamp"],
          "properties": {
            "rule": {
              "type": "string",
              "enum": ["ALL_OF", "allOf"],
              "description": "Derived definitions are ALL_OF. A document tagged {sales, pricing} stays conjunctive so promoting pricing restricts even a holder of still-universal sales."
            },
            "values": {
              "type": "array",
              "items": { "type": "string", "pattern": "^[a-z0-9]+(-[a-z0-9]+)*$" }
            },
            "source": {
              "type": "object",
              "additionalProperties": false,
              "required": ["tagger", "version"],
              "properties": {
                "tagger": { "type": "string" },
                "version": { "type": "string" }
              }
            },
            "threshold": {
              "type": "number",
              "minimum": 0,
              "maximum": 1,
              "description": "Scores below this stay in the assertion only. After promotion a false positive is a denial; a false negative leaves the prescribed baseline."
            },
            "stamp": {
              "type": "boolean",
              "description": "When false, tags for this definition are asserted but never become dataAttributes."
            },
            "promoted": {
              "type": "array",
              "items": { "type": "string" },
              "default": [],
              "description": "Values whose subject mapping is no longer universal. Wrap still stamps them; promotion is a KAS mapping change and a rewrap of already-tagged TDFs."
            }
          }
        }
      }
    },
    "derivedArtifactJoin": {
      "type": "object",
      "description": "How a derived artifact (adapter, sentinel, index) inherits the policies of its training inputs at wrap. This is a property of what an adapter is — a lossy copy of its corpus — not of any one tenant. Hierarchical attributes take the maximum (existing high-water mark). Conjunctive attributes take the union. Provenance attributes are stamped only from asserted facets; a miss is fail-closed.",
      "additionalProperties": false,
      "properties": {
        "hierarchy": {
          "type": "string",
          "const": "max",
          "description": "Clearance and any other hierarchy definition: the derived artifact carries the maximum of its inputs."
        },
        "allOf": {
          "type": "string",
          "const": "union",
          "description": "Conjunctive definitions (project, department): the derived artifact carries every value any input carried. An archive-wide adapter therefore demands allOf every collection it saw."
        },
        "provenanceAttributes": {
          "type": "array",
          "items": { "type": "string", "format": "uri" },
          "description": "Attribute FQNs that may only be stamped from asserted provenance (a connector join), never from the sentinel. Empty means the tenant has not bound the facet and opt-out is omit, not a second code path."
        },
        "missingProvenance": {
          "type": "string",
          "enum": ["unknown", "omit"],
          "description": "unknown: stamp the definition's unknown value, entitled to nobody, and exclude the item from partitioned adapters. omit: do not stamp the attribute (tenant has not bound the facet)."
        }
      }
    },
    "obligationTriggers": {
      "type": "array",
      "description": "PDP-to-PEP directives that accompany a permit. An obligation is not stamped on the TDF; it fires off a resource attribute value. A PEP that cannot enforce the obligation must refuse.",
      "items": {
        "type": "object",
        "required": ["action", "resourceAttribute", "obligation"],
        "additionalProperties": false,
        "properties": {
          "action": { "type": "string" },
          "resourceAttribute": {
            "type": "string",
            "format": "uri",
            "description": "Value FQN on the resource that arms the trigger, e.g. https://attr.arkavo.com/attr/project/value/mallinckrodt"
          },
          "obligation": {
            "type": "string",
            "format": "uri",
            "description": "Obligation value FQN, e.g. https://attr.arkavo.com/obl/handling/value/legal-hold"
          }
        }
      }
    },
    "obligations": {
      "type": "array",
      "description": "Obligation definitions. Grammar is <namespace>/obl/<name> for the definition and <namespace>/obl/<name>/value/<value> for the value. An obligation never grants decryption.",
      "items": {
        "type": "object",
        "required": ["name", "fqn", "assertionType", "grantsDecryption"],
        "additionalProperties": false,
        "properties": {
          "name": { "type": "string", "pattern": "^[a-z][a-z0-9-]*$" },
          "fqn": { "type": "string", "format": "uri" },
          "value": { "type": "string", "pattern": "^[a-z0-9]+(-[a-z0-9]+)*$" },
          "assertionType": { "type": "string", "enum": ["handling"] },
          "grantsDecryption": {
            "type": "boolean",
            "enum": [false],
            "description": "Always false. An obligation that granted decryption would be an entitlement."
          },
          "description": { "type": "string" }
        }
      }
    }
  },
  "definitions": {
    "attributeValue": {
      "type": "object",
      "required": ["fqn", "value"],
      "additionalProperties": false,
      "properties": {
        "fqn": { "type": "string", "format": "uri" },
        "value": { "type": "string" }
      }
    }
  }
}
